{
  "id": "CAM-546",
  "title": "Reconciliar superficie de instrucao e docs com o worker headless: personas, comandos, runbook, ADRs",
  "stage": "idea",
  "status": "open",
  "blockedBy": [],
  "createdAt": "2026-08-11T23:55:19.513Z",
  "updatedAt": "2026-08-11T23:55:19.513Z",
  "description": "Fatia C do epico headless, so prosa. As edicoes de persona que bloqueiam EXECUCAO nao pertencem aqui e andam junto com as fatias A (CAM-521) e B: a sessao tmux privada da Layer A no implementer e o capture-pane da linha 266 do reviewer sao falha em runtime, nao drift de documentacao. Esta fatia cuida do resto, cujo modo de verificacao e fidelidade de prosa, a classe mais dificil de oraculo e por isso separada.\n\nInventario levantado em 2026-08-11, detalhado em memory/project_coerencia_doc_web_headless.md.\n\nPersonas e comandos: .claude/commands/cam-next.md codifica o modelo antigo inteiro (pane titulado, mutex de tres panes, respawn-pane, notifyOrchestrator, fallback de scrollback) e e o unico lugar que ainda afirma a proibicao absoluta de claude -p para workers, na linha 33. cam-review.md:9,26, cam-plan.md:5,30, cam-issue.md:15 e cam-spec.md:3 assumem pane e send-keys como transporte. subagent-implementer.md:117,165,177 descrevem TUI interativa terminada por respawn-pane -k e push de resumo para o pane. subagent-auditor.md:140 e subagent-planner.md:129,191,196 citam pane e tmux como termo de dominio. scripts/cam/CLAUDE.md:36 descreve toda sessao como split de tmux. scripts/cam/patterns.md:14 mantem a proibicao absoluta de claude -p sem citar o recorte do ADR-0059, enquanto scripts/cam/CLAUDE.md:95 ja o carrega, e o roteamento oficial manda grepar patterns.md. patterns.md:74, :338 e :908 documentam premissas mortas.\n\nO que NAO pode ser tocado, verificado linha a linha em 2026-08-11: em subagent-reviewer.md as linhas 39, 45, 50, 51, 54, 55, 158, 183, 194, 228 e 232 sao oraculo e ficam, mas onze delas sao apenas NOMENCLATURA (a etiqueta tmux-drivable de uma especie de oraculo) e nenhuma invoca tmux; a unica com mecanismo e a linha 50, que ja sanciona o caminho sem tmux ao dizer or execute the oracle command directly via Bash. So a linha 266 e transporte e morre. A linha 51 e mista e precisa de reescrita, nao de delecao: o requisito de coletar a saida completa fica, a frase capture-pane text or sai. Quatro linhas de tmux ficaram de fora do inventario original e precisam de tratamento: 66 (checklist de seguranca), 74 e 121 (higiene de panes orfaos) e 134 (regra anti-mock que registra a licao do CAM-55 e sobrevive verbatim).\n\nRunbook, docs/recovery-runbook.md, 27 secoes: cinco orfas, quatro conflitos duros. Secao (x) na linha 2100 instrui ativamente o caminho de credencial que o contrato proibe. Secao (f) na linha 222 afirma que -p e proibido para contas de subscricao citando CAM-42, colidindo com o item 1 do contrato. Secao (c) na linha 118 e a unica receita de finalize manual pos-crash e precisa ser reancorada em worker-report.json mais event log antes de qualquer delecao. Secao (y) na linha 2324 sai de graca, duplicada na (n). Orfas restantes: (b) 87, (e) 189, (k) 560, (p) 1091.\n\nADRs: quatro supersessoes nascem aqui, sempre por ADR novo e nunca por reescrita do antigo, seguindo o precedente ADR-0049 para ADR-0050. Sao 0004 (planner em pane), 0059 (headless por flag), 0046 (codex em pane TUI) e a secao de credencial do 0003. Ponta solta estrutural: nao existe campo de status nos ADRs de 0010 a 0062, entao nao ha onde marcar supersessao, e hoje supersessao e prosa em negrito no fim do arquivo.\n\nREADME tem seis conflitos duros da mesma familia (tmux split universal, injecao por send-keys, respawn por wrapper, workers como TUI, container como opt-in com host por default, secao inteira de panes nas linhas 261-274).\n\nRegra de oraculo que governa esta fatia: para deliverable de prosa, grep de presenca de token nao verifica nada sobre fidelidade. Cada afirmacao factual citada da spec precisa de oraculo que FALHE quando a afirmacao for trocada por prosa plausivel inventada, varrido VERMELHO contra uma copia com evidencia fabricada antes do dispatch."
}
