{
  "id": "CAM-411",
  "title": "Epic: worktree por story/issue: isolamento de execucao",
  "stage": "idea",
  "status": "open",
  "blockedBy": [],
  "createdAt": "2026-07-25T00:47:32.955Z",
  "updatedAt": "2026-07-25T00:47:32.955Z",
  "description": "Padrao consolidado do mercado (Forge, Zeroshot, Orca, Gas Town, Conductor) e prioridade do doc de estrategia web (secao 21). Fatia 1, isolamento ainda serial: cada story ou ciclo roda em worktree isolado, com ganhos imediatos de blast radius, reversibilidade, diffs limpos, recovery mais simples e review mais claro, sem nenhuma complexidade de concorrencia. Fatia 2 (desbloqueia CAM-147): paralelismo issue-level em worktrees, nunca story-level dentro do mesmo PRD (licoes empiricas de convergencia de review com PRDs grandes e conflitos de design entre stories irmas). Teto honesto: numa unica assinatura, N workers paralelos queimam a mesma janela de 5h N vezes mais rapido; o paralelismo real depende do epico do subscription pool."
}
