{
  "id": "CAM-438",
  "title": "Oracle lint frozen-comparand over-fires on live-derived values assigned in an adjacent clause",
  "stage": "idea",
  "status": "open",
  "blockedBy": [],
  "createdAt": "2026-07-27T16:54:18.076Z",
  "updatedAt": "2026-07-27T16:54:18.076Z",
  "description": "MEDIDO em 2026-07-27 no plano do CAM-434 (escalou em 2 rounds, roundsCompleted=2, sem nunca chegar no auditor). O planner escreveu o oraculo `d=$(git diff --numstat main -- <adr> | awk '{print $2}'); test -z \"$d\" || test \"$d\" -eq 0` e a regra frozen-comparand do lint deterministico de oraculo (patterns.md, regra citada no marker .cam-plan-escalated.json) rejeitou porque a comparacao contra o inteiro literal esta numa clausula SEPARADA da derivacao `git diff main`.\n\nPOR QUE E FALSO-POSITIVO: o valor comparado ($d) E derivado ao vivo da main; o unico literal e o 0, e 0 nao apodrece quando a main muda, porque a assercao e 'zero delecoes', nao 'exatamente N linhas'. A regra existe para pegar `test \"$(wc -l < file)\" -eq 42`, onde o 42 congela um fato da main. A forma 'derivar numa clausula, comparar com 0 na seguinte' e a forma NATURAL de todo pin de invariancia de contagem, e hoje ela e barrada mesmo estando correta.\n\nCUSTO MEDIDO: um plano inteiro escalado (2 rounds de planner queimados) num oraculo semanticamente correto. O orquestrador contornou re-especificando o CAM-434 com uma forma de identidade-de-prefixo sem inteiro nenhum, o que e mais forte, mas o contorno nao escala: toda futura AC de invariancia por contagem vai bater na mesma parede.\n\nESCOPO PROPOSTO: refinar a regra para aceitar o comparando literal quando a variavel comparada e atribuida a partir de um token de derivacao viva (git show main:/git diff main/git grep ... main) dentro da MESMA lista de comandos, fazendo dataflow de uma atribuicao, nao so casamento por clausula. Non-goal: afrouxar a regra para literal comparado contra valor nao derivado, que e exatamente o defeito que ela existe para pegar e que ja custou ciclos (CAM-424).\n\nVERIFICACAO: teste que prova que a forma derivada-em-clausula-adjacente passa e que `test \"$(wc -l < f)\" -eq 42` com comparando congelado continua sendo barrada."
}
