{
  "id": "CAM-55",
  "title": "cam run como hub unico: comandos CLI viram thin-proxies do orquestrador + worker-pane unico titulado com report no exit",
  "stage": "shipped",
  "status": "open",
  "blockedBy": [],
  "createdAt": "2026-06-15T16:00:00Z",
  "description": "DESIGN SPIKE + IMPLEMENTACAO. PROBLEMA: o cam tem dois front-ends que dividem a mesma sessao tmux sem coordenacao (orquestrador do `cam run` que despacha /cam-* inline, vs CLI `cam plan`/`next`/`issue` que spawnam worker-pane), e eles colidem (worker-pane tangle, panes a mais, false-positive de stale do CAM-47). Comportamento inconsistente observado: as vezes o orquestrador abre um terceiro pane, as vezes roda inline. Caso real: operador rodou `cam plan 52` + `cam run`, o plan nao produziu PRD (worker-pane se enrolou com uma /cam-issue anterior, nenhum registro do 52). PRINCIPIO (decisao do operador): `cam run`/orquestrador e o HUB UNICO; TODOS os outros comandos sao vinculados a ele, executados dentro do orquestrador (sessao ativa) OU via CLI (thin-proxy que injeta no orquestrador). Uma unica forma de fazer trabalho (o orquestrador despacha), dois pontos de entrada. MODELO: (1) CLI thin-proxy: `cam plan 52` (e issue/review/ship/next) detecta orquestrador vivo -> send-keys atomico (texto+Enter na MESMA chamada) injetando o pedido em linguagem natural no %0 -> retorna (fire-and-forget). Sem orquestrador vivo -> spawna `cam run` (bootstrap), espera o boot ficar pronto (poll), entao send-keys. (2) Worker-pane SEMPRE (uniforme, fim do inline): qualquer subagente despachado roda num terceiro pane VISIVEL e REUSADO, re-rotulado por fase (plan -> implementer -> reviewer -> ship). Layout: 2 panes em repouso (orquestrador %0 + dashboard %1), 3 com worker ativo. (3) Titulo no worker-pane: setar @cam_label = papel do subagente, reusando o pane-border-format/pill (verde) que orquestrador e dashboard ja usam via pane-border-status top. (4) MUTEX de worker unico: um comando so pode spawnar o terceiro pane se a sessao estiver em EXATAMENTE 2 panes. Se ja ha worker ativo (3 panes) e outro despacho e tentado (ex: `cam next` no terminal enquanto o worker do `cam plan` esta aberto), e BLOQUEADO ate o terceiro pane fechar + a mensagem de conclusao ser captada pelo orquestrador. (5) Ciclo de vida: o worker-pane roda `claude --agent X` SEM o wrapper de kill-session (so o orquestrador tem esse); `/exit` no worker-pane fecha SO o pane, a sessao sobrevive. (6) Report no exit (push, nao pull): ao fechar, o worker-pane manda mensagem ao orquestrador dizendo se encerrou APOS concluir tudo OU sem concluir, via bash `tmux -L cam send-keys -t '%0' \"<report>\" Enter` (atomico, consistente com o padrao de msg entre sessoes ja usado). Isso INVERTE a deteccao de conclusao: o worker EMPURRA o status no exit em vez do supervisor POLLAR o scrollback atras do sentinel (mata a classe de bug supervisor-sentinel-parse-fragility). O payload do report e o verdict estruturado da CAM-56. (7) Fix do isSessionStale: aceitar 2 OU 3 panes (o 3o sendo worker titulado, nao cat/stray); mata o false-positive do CAM-47 de vez. A DECIDIR NO SPIKE: destino do runSupervisor (src/supervisor/loop.ts), com report-push + mutex, o orquestrador (que recebe o report e decide o proximo despacho via decideNextAction) absorve a logica de loop, ou o supervisor sobrevive lendo reports empurrados em vez de pollar scrollback; como o bootstrap do `cam run` via CLI espera o boot; como garantir o orquestrador idle pra receber o report (senao enfileira no input). ARQUIVOS: src/commands/run.ts (worker-pane spawn + wrapper sem kill-session + @cam_label), src/commands/plan.ts/next.ts/issue.ts (thin-proxy + deteccao + bootstrap), src/tmux/session.ts (isSessionStale aceitar worker-pane; predicado orquestrador-vivo; mutex de pane-count), src/supervisor/loop.ts (push vs pull), .claude/agents/subagent-orchestrator.md (receber reports + despacho uniforme), .claude/commands/cam-*.md, espelhar templates/ + embed-vendor. RELACIONA: CAM-42 (modelo TUI-worker + sentinel que isso re-arquiteta), CAM-47 (o false-positive de stale que isso resolve de vez), CAM-56 (verdict estruturado = payload do report), CAM-23 (orquestrador como hub), CAM-54 (o adapter de backend codex constroi sobre esse modelo de dispatch; CAM-55 vem antes). ABSORVE a guardrail menor antes cogitada (cam plan detecta orquestrador). ACEITE: comportamento de pane UNICO e consistente (sempre worker-pane reusado titulado); CLI plan/next/issue/review/ship roteiam pro orquestrador (vivo ou bootstrapado); mutex impede 2 workers concorrentes; worker /exit fecha so o pane + reporta conclusao via send-keys; isSessionStale tolera o worker-pane; spike documenta o destino do supervisor ANTES de implementar; typecheck; tests.",
  "updatedAt": "2026-06-15T16:00:00Z"
}
