{
  "id": "CAM-73",
  "title": "Habilitar branch protection (required status checks) na main agora que o repo e publico + CI existe; corrigir a premissa 'free private plan' em docs/agent-readiness.md",
  "stage": "shipped",
  "status": "open",
  "blockedBy": [],
  "createdAt": "2026-06-23T21:08:52Z",
  "description": "ACHADO (dogfood do CAM-59, PR #65): o repo cam-cli e PUBLICO (gh api repos/.../  private:false), nao private. O CAM-59 e o docs/agent-readiness.md assumiram que branch protection era um 'structural fail of the free private plan' (linhas 25 e 33-34 do doc: 'branch_protection blocked (free private plan)' e 'branch_protection as a structural fail of the free private plan'), e a nota do proprio CAM-59 dizia 'hard merge-block via branch protection is unavailable on the free private plan'. Premissa errada: repo publico tem branch protection + required status checks de graca. ESCOPO: (a) corrigir docs/agent-readiness.md: branch_protection deixa de ser impossibilidade estrutural e vira um gap fechavel; reavaliar a contagem da linha 'Development Workflow' e a nota de judgment-call (linhas 32-34). (b) Habilitar required-status-checks branch protection na main exigindo o check de CI do CAM-59 (gh api repos/eduardocaminha/cam-cli/branches/main/protection ou via UI), agora que a CI existe e o merge-block e de fato possivel. CONTEXTO: o CAM-59 entregou o sinal + ci-parity dizendo explicitamente que o merge-block estava fora de alcance; o CAM-73 destrava o merge-block real. Passa pelo loop + review normal. Relaciona: CAM-59 (CI keystone, entregou o check), CAM-49/CAM-27 (invariantes de estado per-branch).",
  "updatedAt": "2026-06-23T21:08:52Z"
}
