{
  "id": "CAM-507",
  "title": "Pane de worker parado em dialogo interativo queima os 30 min inteiros de timeout: 3a ocorrencia de planner-timeout, 2 causas distintas, nenhuma deteccao",
  "stage": "idea",
  "status": "open",
  "blockedBy": [],
  "createdAt": "2026-08-05T22:42:21.781Z",
  "updatedAt": "2026-08-05T22:42:21.781Z",
  "description": "TERCEIRA OCORRENCIA MEDIDA de dispatch-failed reason=planner-timeout, e a primeira com causa raiz de dialogo interativo. Em todas as tres o pane estava VIVO e PARADO num estado terminal detectavel, e o cam esperou o orcamento inteiro de 30 minutos antes de desistir, perdendo o round de plano completo.\n\nOCORRENCIA DE HOJE (2026-08-05T22:38:50.858Z, pane %115, uuid 10822791-9f8a-456c-ae5d-571b57e22ecb, CAM-503 round 2 de re-plan). O planner rodou um comando composto de Bash com um rm de limpeza do proprio probe: `rm -rf /tmp/bunprobe; head -c 600 scripts/file-size-budget.json; ...`. O harness do Claude Code interceptou com o dialogo de confirmacao e o log termina exatamente ali:\n\n    Dangerous rm operation on working directory or its ancestor: /tmp/bunprobe\n    Do you want to proceed?\n    1. Yes\n    2. No\n    Esc to cancel  Tab to amend  ctrl+e to explain\n\nNao ha operador no pane de worker para responder, entao o pane ficou nesse prompt por cerca de 28 minutos ate o timeout. Custo concreto: o round 2 ja tinha absorvido as 3 findings do BLOCK do auditor (breadth de deteccao do gate, quinto acumulador cam-cli-task-prompts-<pid> nao tratado, e ordenacao que mede a AC5 duas stories antes de fechar os leaks do produto) e todo esse trabalho foi perdido, com o prd.json limpo e o loop voltando para idle.\n\nO guard NAO e do cam: a string 'Dangerous rm operation' nao existe em nenhum arquivo do repo (grep sobre ts, sh, json e md, fora node_modules). E built-in do harness upstream, e o classificador ainda por cima erra, porque /tmp/bunprobe nao e o working directory nem ancestral dele. O cam nao pode remover o prompt, mas pode parar de esperar 30 minutos por ele.\n\nAS DUAS OCORRENCIAS ANTERIORES tem causa DIFERENTE e mesmo desfecho, o que e o argumento central de que o conserto certo e generico e nao ligado a rm. Em 2026-07-30T06:51:20.183Z (pane %44, log a251d32e) e 2026-07-30T07:24:48.214Z (pane %45, log c50547bc) os dois logs terminam identicos em 'API Error: 529 Overloaded. This is a server-side issue, usually temporary, try again in a moment', com o pane em retry ate estourar. Ou seja: dialogo de permissao e erro 529 sao entradas distintas para o mesmo buraco, que e a ausencia de qualquer deteccao de pane vivo-porem-parado.\n\nCONTRASTE COM O QUE JA E TRATADO: as outras 19 dispatch-failed do event log (implementer-timeout e review-timeout, reasons pane-pid-after-empty e pipe-pane-exited) sao pane MORTO ou desaparecido, ja detectadas rapido e auto-recuperadas (CAM-477). O caso vivo-parado nao tem nenhuma cobertura.\n\nDIRECAO SUGERIDA, nao spec: detector de estado terminal no pane, lendo o proprio out-log que ja e escrito (cam-plan-out-*.log), reconhecendo pelo menos as duas assinaturas medidas (prompt de confirmacao com 'Do you want to proceed?' e o rodape de 'API Error: 5xx') e falhando rapido com reason especifico, em vez de gastar o orcamento inteiro. Alternativa mais forte e complementar: heuristica de no-progress por ausencia de escrita nova no out-log por N minutos, que cobre assinaturas ainda nao vistas.\n\nEVIDENCIA: .claude/cam-worker-events.jsonl (3 eventos dispatch-failed com reason planner-timeout), .claude/cam-plan-out-planner-10822791-9f8a-456c-ae5d-571b57e22ecb.log (prompt de hoje no fim do arquivo), .claude/cam-plan-out-planner-a251d32e-9453-4205-b0c2-09c44563b2cf.log e .claude/cam-plan-out-planner-c50547bc-d8b0-4f9c-9561-52aff057af2b.log (os dois 529 de 30/07)."
}
