{
  "id": "CAM-446",
  "title": "orch-recycle-watch.test.ts non-determinism under CPU-restricted env -i run must be fixed at root, not licensed as an artifact",
  "stage": "specified",
  "status": "open",
  "blockedBy": [],
  "createdAt": "2026-07-27T23:08:43.820Z",
  "updatedAt": "2026-08-05T18:54:33.012Z",
  "description": "During US-002 (CAM-424) verification of test/preflight-deps.test.ts, an env -i restricted-PATH bun test run (a literal PRD oracle, US-002 AC4) hit a failure in test/integration/orch-recycle-watch.test.ts, an e2e SIGTERM/respawn test with real subprocess timing unrelated to dependency preflight. The failure reproduced clean both standalone and on an immediate re-run at full-suite scope. patterns.md previously carried a doctrine carve-out (since removed in US-R1-001, CAM-433) treating a solitary timing-only failure under a resource-restricted run as an acceptable resource-contention artifact worth one re-run to confirm before concluding root cause. That carve-out is a no-flaky-evasion violation regardless of the failure characterization: non-determinism in a test is itself a defect. Root cause candidate: the test bounds five sequential waitForCondition polls (has-session default, pgrep-initial 5s, pgrep-watcher-scheduled 10s, session-marker-change 12s, pgrep-new 10s) inside a single 45s outer test timeout (test/integration/orch-recycle-watch.test.ts around lines 180-251); under CPU contention the cumulative real subprocess/tmux/pgrep latency across all five waits can exceed the 45s outer budget even when each individual wait is within its own timeout. Fix should either raise the outer test timeout to a value that provably covers the worst-case sum of the five inner budgets with margin, or make the test's own timeout budgets self-consistent (assert sum-of-inner <= outer via a computed constant) rather than independently authored magic numbers that can silently violate that invariant.",
  "spec": {
    "acceptanceCriteria": [
      "AC1 (change-detection, VARRIDO VERMELHO na main em 2026-08-05: exit 1, falhou ja na rodada 1). A suite COMPLETA roda cinco vezes consecutivas e as cinco ficam verdes. Este e o criterio central e ele reproduz no ambiente onde o defeito FOI observado. Oraculo literal: for i in $(seq 1 5); do bun test >/dev/null 2>&1 || { echo \"FAIL on suite run $i\"; exit 1; }; done; echo ALL-GREEN",
      "AC2 (pin de invariancia, comparand DERIVADO da main no momento do check, nunca congelado; varrido em 2026-08-05: VERDE na arvore limpa com main=7 e branch=7, VERMELHO sob mutacao com branch=0, restaurado com git diff vazio). Fecha o buraco da AC1: cinco rodadas verdes sao gameaveis ENFRAQUECENDO o teste, entao a superficie de tmux real tem que sobreviver ao conserto. Usa -ge e nao -eq de proposito, porque pin por igualdade-de-contagem da falso-positivo em append legitimo (CAM-491). Oraculo literal: F=test/integration/orch-recycle-watch.test.ts; M=$(git show main:$F | grep -c tmuxRaw); B=$(grep -c tmuxRaw $F); [ \"$B\" -ge \"$M\" ]",
      "AC3 (gates): bun run typecheck, bun test e bun run check:all verdes."
    ],
    "scope": "Eliminar na raiz a nao-determinancia de test/integration/orch-recycle-watch.test.ts, que so se manifesta sob execucao de suite COMPLETA. FORA DE ESCOPO: mudar comportamento de producao do recycle watcher, porque o defeito e do teste; outros testes nao-deterministicos; e a coerencia de budgets por construcao (constantes nomeadas e outer computado), separada para o CAM-506 em 2026-08-05 por MODO DE VERIFICACAO, ja que aquilo se prova por assercao de invariante mais mutacao e isto se prova por cinco rodadas verdes.",
    "gotchas": [
      "MECANISMO MEDIDO: a falha NAO e o outer de 45s estourado pela soma dos waits. E o wait interno de session-marker-change, cujo budget e 12s. Quatro medicoes em 2026-08-05, todas em preflight morto: 12209, 12151, 12183 e 12188 ms. Qualquer plano que so mexa no outer esta consertando o mecanismo errado.",
      "SATURACAO DE CPU NAO REPRODUZ O DEFEITO. Medido em 2026-08-05 varrendo um oraculo candidato: 24 spinners de CPU em 12 cores, load ~60, suite completa VERDE; a mesma suite sem carga artificial ficou VERMELHA ja na primeira rodada. O oraculo de carga foi DESCARTADO por estar verde na main. Portanto NAO ir atras de budget de CPU nem de starvation: o gatilho e especifico da execucao concorrente da suite (I/O, tabela de processos, file descriptors, tmux). Este resultado negativo custou uma varredura completa, nao re-derivar.",
      "ISOLAMENTO TAMBEM NAO REPRODUZ. Seis de seis rodadas isoladas do arquivo deram verde em 2026-08-04/05. Todo criterio baseado em rodar o arquivo sozinho N vezes JA NASCE VERDE na main e nao prova nada. Isolamento e um ambiente onde o bug nao existe.",
      "DADOS CENSURADOS A DIREITA: toda falha observada e censurada no proprio budget. As quatro medicoes batem em 12,15 a 12,21 s porque e onde o timeout dispara, nao onde a latencia real esta; elas so dizem que a latencia e maior ou igual a 12s, nunca quanto. PROIBIDO derivar um budget novo delas. Se algum budget de relogio sobreviver ao conserto, ele precisa de medicao INSTRUMENTADA da duracao real do wait no momento em que o predicado vira.",
      "TEARDOWN DE FIXTURE DE CARGA: kill $(jobs -p) NAO e confiavel em shell nao-interativo, porque job control fica desligado e jobs -p devolve vazio. Medido em 2026-08-05 duas vezes no mesmo dia: 24 spinners de outra sessao orfanaram por isso, e depois os 24 spinners do meu proprio oraculo sobreviveram ao mesmo padrao, apesar do trap em EXIT INT TERM. Qualquer fixture que suba processo de carga tem que derrubar por pgrep ou por grupo de processo.",
      "MUTACAO ALVEJA DEFINICAO, NUNCA PONTO DE USO. O PRD gerado em 2026-08-05 escalou por violar isso: US-002 mutava o texto timeoutMs: <CONST> dentro do teste de integracao enquanto US-001 mandava introduzir um helper timedWait(name, predicate) que APAGA esse texto, entao a mutacao caia em mutation-not-applied e o oraculo se auto-reprovava. A coerencia de budgets saiu para o CAM-506; se alguma mutacao for escrita aqui, alveja a definicao.",
      "O teste JA usa waitForCondition corretamente. O defeito NAO e setTimeout fixo. Nao trocar a primitiva.",
      "O teste exercita subprocess real, tmux real e pgrep real. Nao substituir por fake para estabilizar: destruiria o valor do e2e e cairia na regra de que asserir que o mock foi chamado e documentacao, nao verificacao. A AC2 existe para guardar exatamente isso.",
      "patterns.md:1094 (US-R1-001 do CAM-433) removeu explicitamente a doutrina que licenciava esta falha como artefato de contencao. Nao reintroduzir essa prosa em nenhuma forma, nem como comentario no teste.",
      "PRIORIDADE: matou SETE de NOVE dispatches de plano em 2026-08-05, incluindo o dispatch do proprio conserto dele. E o custo nao para no preflight: um worker rodando bun test como gate de story corre o mesmo risco, e a regra no-flaky-evasion o obriga a HALTAR, entao o defeito injeta parada em qualquer ponto do loop.",
      "Cuidado com a regra deterministica frozen-comparand do prd-oracle-lint: nao escrever criterio na forma test $x -eq N. A AC1 usa o exit code do proprio comando e a AC2 deriva o comparand da main no momento do check.",
      "O $TMPDIR desta maquina passou de 200 mil diretorios e foi purgado em 2026-08-05, derrubando a suite de 265s para 98s. A fonte esta filada como CAM-503 e nao esta consertada; se a suite voltar a lentificar, revalidar as medicoes acima antes de confiar nelas."
    ],
    "domainTerms": [
      "wait censurado a direita",
      "pin de invariancia com comparand derivado",
      "oraculo de deteccao de mudanca",
      "condicao de carga declarada"
    ]
  },
  "wsjf": {
    "value": 8,
    "timeCriticality": 9,
    "riskReduction": 8,
    "jobSize": 1
  },
  "type": "fix"
}
