{
  "id": "CAM-547",
  "title": "Gate comportamental e inerte: construir no supervisor, nao instruir na persona",
  "stage": "idea",
  "status": "open",
  "blockedBy": [],
  "createdAt": "2026-08-12T05:22:46.430Z",
  "updatedAt": "2026-08-12T05:22:46.430Z",
  "description": "MEDICAO de 2026-08-12, janela de 27/jul a 11/ago, 304 sessoes de worker registradas em .claude/cam-worker-out-*.log.\n\nA Layer A do gate comportamental rodou 2 vezes em cerca de 154 oportunidades. 154 dos 304 logs carregam diretiva [oracle: ...] em acceptanceCriteria (64 named-command, 56 file-assert), entao oportunidade era abundante. Prova de execucao real: apenas 2 logs contem CAMGATE_, o marcador de exit code que so existe dentro da sessao privada do gate; 1 contem o nome do socket cam-behavioral-gate; 3 contem runBehavioralGate com parentese de chamada. O campo gates do event log, em 1.302 entradas kind:result, so assume dois valores, {typecheck, tests}; nunca houve entrada de gate comportamental.\n\nA Layer B tambem nunca produziu artefato. scripts/cam/review-artifact.txt nunca foi commitado na historia do repo, e o campo artifactOfRecord nunca foi setado em nenhum review-report.json commitado.\n\nCAUSA ESTRUTURAL medida. runBehavioralGate (src/supervisor/behavioral-gate.ts, 464 linhas) nao tem NENHUM call site em producao: grep em src/ devolve so a propria definicao e o texto do prompt embarcado em src/vendor/_generated.ts. E o comando literal que a persona manda rodar nao existe como executavel: o modulo nao tem import.meta.main, nem shebang, nem leitura de process.argv, entao bun src/supervisor/behavioral-gate.ts carrega o modulo, nao roda nada e sai 0 em silencio. O gate depende do LLM lembrar de invocar uma biblioteca, e 2 em 154 e exatamente a taxa que esse desenho produz.\n\nREENQUADRAMENTO. O item 2 do contrato (memory/project_definicoes_web_headless.md, emenda 3 de 2026-08-11) decidiu manter a Layer A sem tmux, por execucao direta via Bash, e rejeitou elimina-la com o argumento de que isso empurraria a deteccao do defeito para o reviewer. A medicao mostra que a deteccao JA esta no reviewer em toda a historia registrada: o cenario que a decisao evitava e o status quo. Logo a decisao real nao e migrar a Layer A de tmux para Bash, e sim construir o gate comportamental pela primeira vez, ou aposenta-lo explicitamente e assumir que oraculo e verificado pelo reviewer mais gates deterministicos. Decisao do operador em 2026-08-12: construir.\n\nDIRECAO DE DESENHO. O gate precisa de call site em PRODUCAO no supervisor, executado deterministicamente, nao instrucao em persona. Um gate que depende de um agente se lembrar nao e gate. Consequencia que vem junto: para as especies named-command e file-assert o tmux e desnecessario, porque foi medido que runBehavioralGate detecta exatamente tres coisas, o exit code de um comando de shell (concatenado com echo CAMGATE_$? e raspado de volta do texto do pane), um timeout de 30s, e o texto do pane para fix-with-vision. Bun.spawn com bash -c nao perde nada disso e e mais confiavel: o pane e fixado em 220x50, entao oraculo verboso pode rolar o marcador para fora da tela ou quebrar a linha, produzindo timeout espurio. O que o PTY entregaria de verdade (isTTY true, geometria deterministica, pane renderizado em vez de byte stream) nenhuma especie de oraculo atual sabe expressar: a unica que expressaria, tmux-pty, retorna passed:false com o texto requires external verification e e explicitamente pulada nas duas camadas. Se o PTY tiver que sobreviver, e a especie tmux-pty que precisa ganhar atuador, nao o caminho named-command.\n\nESCOPO. Decidir e implementar o call site deterministico, decidir o destino da especie tmux-pty, reescrever as instrucoes de Layer A e Layer B para refletir o mecanismo real, e fazer o campo gates do event log passar a registrar o resultado do gate comportamental para que a proxima medicao seja possivel sem forense de log. Fora de escopo: CAM-526 (furo de bypass do write-guard por Bash).\n\nRelacao com o epico headless: enquanto esta issue nao shipar, a instrucao de subagent-implementer.md:88 continua como esta, porque ela e inerte e portanto inofensiva; ela nao bloqueia CAM-544 nem CAM-521."
}
