{
  "id": "CAM-432",
  "title": "Sweep: deletar os 103 gating sites mortos de git e jq preservando o inventario de I/O real (metade B do CAM-424)",
  "stage": "specified",
  "status": "open",
  "blockedBy": [],
  "createdAt": "2026-07-27T07:18:45.779Z",
  "updatedAt": "2026-07-27T07:18:45.779Z",
  "description": "Metade B do split do CAM-424, e depende dele: so faz sentido depois que o preflight fail-loud do CAM-424 tornar esses gates mortos. NAO fecha buraco de verificacao nenhum, e remocao de codigo morto habilitada pela metade A.\n\nESCOPO: deletar 72 linhas `skipIf(!gitAvailable` (25 arquivos) e 31 linhas `skipIf(!jqAvailable` (2 arquivos), total 103 linhas em 27 arquivos, convertendo cada teste gated de volta em teste comum. Manter os corpos dos testes: deletar o gate NAO pode deletar o teste.\n\nJUSTIFICATIVA MEDIDA (nao estilistica): git e jq existem em todo lane suportado (git, jq, pgrep, ps e uuidgen vem pre-instalados na imagem macos-latest, e o .devcontainer/Dockerfile instala git e jq), e o gating ja e incoerente hoje: derrubar git do PATH produz 37-38 falhas duras vindas de testes igualmente git-dependentes que nao sao gated. Ou seja o predicado nao protege nada e apenas anuncia um modo git-less que comprovadamente nao funciona. Contraste com tmux, que e o unico buraco silencioso de verdade (37 testes somem e a suite sai 0).\n\nORACULO DE CONCLUSAO: `grep -rn \"skipIf(!gitAvailable\\|skipIf(!jqAvailable\" test --include=*.ts` retorna vazio. Baseline varrido na main: 103 linhas.\n\nPISO DE PASS OBRIGATORIO: o modo de falha real desta issue e deletar o corpo do teste junto com o predicado, o que ainda daria exit 0 sem skips, isto e uma suite menor reportada como controle limpo. Toda story precisa assertar contagem de pass nao inferior a da main, DERIVADA em tempo de checagem e nunca congelada como literal (patterns.md:903). Baseline medido em 44accd73: 5634 pass / 0 fail / sem linha de skip / exit 0.\n\nPINS DE INVARIANCIA MUST-SURVIVE (ancorados e varridos; sao pins de invariancia, logo verdes na main POR CONSTRUCAO, com comparando derivado de `git show main:<path> | grep -c`, ao contrario de oraculos de deteccao que tem que ser varridos vermelhos): (i) git real, `grep -rnP \"spawnSync\\((\\\"|')git\\1, \\[(?!\\\"--version\\\"|'--version')\" test/` == 73 linhas em 29 arquivos; precisa de `grep -P` pelo lookahead negativo, e a variante so-aspas-simples da 72/28 porque perde a chamada com aspas duplas em test/vendor/check-agent-frontmatter-standalone.test.ts:32; conferencia aritmetica: 98 ocorrencias totais de `spawnSync(git` em test/ menos 25 probes `['--version']` == 73, e ocorrencia == linha, entao deletar qualquer chamada decrementa exatamente 1. (ii) pgrep, `grep -rnE \"spawnSync\\('pgrep', \\['-f',\" test/integration/orch-recycle-watch.test.ts` == 5. (iii) ps, `grep -rnE \"spawnSync\\('ps', \\['-ax',\" test/` == 1, e PRECISA ser escopado em test/ porque repo-wide da 3, um deles um comentario JSDoc em src/commands/orch-recycle-watch.ts:98. (iv) tmux drivers, escopado em test/: forma node `grep -rnE \"^[^/*]*spawnSync\\((\\\"|')tmux(\\\"|'), ?\\[(\\\"|')-L(\\\"|')\" test/` == 13 e forma Bun `grep -rnE 'Bun\\.spawnSync\\(\\[\\\"tmux\\\", \\\"-L\\\"' test/` == 5, total 18; o guard `^[^/*]*` e load-bearing, sem ele a forma node da 14 casando o comentario em tmux-introspect.test.ts:191.\n\nARMADILHA QUE JA CUSTOU DUAS ESCALADAS NO CAM-424, nao repetir: nunca escrever oraculo que casa NOME DE BINARIO. Um grep por nome retorna 132 linhas na main das quais so ~45 sao probes; o resto e I/O real protegido pelo ADR-0039 (docs/adr/0039-cam-testing-philosophy-behavioral-di-fakes-plus-real-i-o-at-wire-boundaries-not-no-mocks-ever.md). E nunca usar substring nua sobre arquivo que tambem fala do assunto em prosa: `grep -qc 'pgrep' <arquivo>` e verde na main E verde depois de deletar todas as 5 chamadas reais, alem de `-q` anular `-c`.\n\nSHAPE DE STORY: manter git (72 linhas / 25 arquivos) e jq (31 linhas / 2 arquivos) como stories SEPARADAS. Argumento de qualidade, nao de custo: o seam ja esta medido e limpo, e a story combinada tem o maior risco de exaustao de contexto do PRD.\n\nNAO TOCAR em test/fixtures/version-skip-guard/** (7 arquivos, 7 ocorrencias de .skipIf): sao as fixtures do scripts/check-version-skips.ts e edita-las quebra aquele gate.",
  "specSource": "derived",
  "derivedFrom": [
    "CAM-424"
  ],
  "wsjf": {
    "value": 4,
    "timeCriticality": 3,
    "riskReduction": 4,
    "jobSize": 3
  }
}
